semantic derivation,domain,semantics,PA_root,PIE,IE_cognates,translation,luw,hitt,pal,lyd,lyc_A,lyc_B,pis,sid,car,comments
"J.Puhvel: field (curve line between valleys) → battle field → battle → agression; E.Rieken: UNKNOWN SOURCE → anger, hostility",anger,be agressive; pick a fight,*kop-í-lo-,*kop-/*kap-,"Skt. šap- ‘to scold, to curse (Eichner); this correlation, however, does not fit Luwian data","hostile; to anger?, irritate?, pick a fight?","kapilali- ""enemy"" (HL); kappilazza- ‘to become hostile’ (CL)","kappilā(i/e)-, kappila- 'pick a fight'; kappilahh- 'get in a fight'; kappilali- 'prone to fight, aggressive' ; kappi- 'small, lessen, diminish' (Puhvel HED k:61-63)",,,,,,,,"*kamp- as in Lat. campus 'field' > OHG kampf 'joust, fight'. Puhvel (HED K:65); Eichner (1979a: 61) suggest comparison with Skt. šap- ‘to scold, to curse’ < *ḱep-, but this should have yielded Luw. **zapp- (see Kloekhorst 2008:439). See also Gk. κάμπτο< *καμπ-ιω 'bend', cf. Hitt. kappi- 'small, lessen, diminish'."
be sick → be in anger,anger,anger,,*seh2i-ti,"Lat. saevus ‘wild, furious, ferocious’,  Goth. sair, OHG sr ‘pain’.",to be angry,,"šā(i/e)-, šānt-, šā(u)war Neumann: ?šā(i)- ‘to become sullen, to be angry’; Melchert: ?",,,,,,,,
"go up the stairs → escalate, get tension up → be angry",anger,anger,*ela(n)-/*ila(n)- + reduplication,,Gk. ελαω- 'drive; harass,anger,,lēlaniya-,,,,,,,,"Puhvel (HED L:80-81): lelaniya- is a reduplication of HED E-I:268-269 elaniya- 'escalate, drive' (comparison with Gk. ελαω- 'drive; harass'). A.Kassian (pers.comm.) writes: ""If a basic sense of elaniya is 'to escalate', perhaps denominative from ila(n)-; ilan-iya HED E-I: 357 - stairs, ladder"""
"flow → overwhelming feeling → envy, anger (datsemshift.ru: to overflow → to get angry); flow → worry → irritation → anger → envy",anger,envy,"*ars-ne/na-, *Hrs-n-h1-","*H(1-3)rs-ne-h1-ti, *H(1-3)rs-n-h1-enti ","Av. arəšiiant- ‘envious’, araska- ‘envy‘ Skt. ī́rṣyant- ‘angry’, irasyáti ","offense, offended; envy, envious; irritation and anger from envy",Luw. ar-ši-ma-na-al-li-ya-an ‘belonging to enviers’,aršan(iye/a)-,,,,,,,,"Kloekhorst (EDHIL: 210) reconstructs PIE form for aršaniye/a- as *h1/3rs-ne-h1-ti / *h1/3rs-n-h1-enti, basing on Skt. ī́rṣyant- ‘angry’, irasyáti ‘to be angry’, Av. arəšiiant- ‘envious’, araska- ‘envy‘. (HED A: 173) points at possible parallel with Toch.A rse 'hate’. I.Yakubovich (ACLT) suggests including here Luw. ar-ši-ma-na-al-li-ya-an ‘belonging to enviers’ (ACLT; see also eDiAna, where this lexeme appears in context as a hapax in a list of merisms, and the meaning remains unclear)."
eat → entrails eaten up → to be bad → to be angry,anger,evil,"*edwal (Laroche, HED E-I:493); *h1edu̯ol- ‘evilness’, *h1edu̯o- 'evil' (EDHIL:421)",*h1ed- ‘bite (→ eat)',"Arm. erkn, ‘labour pains’, Gr.‘pain’ and OIr. idu ",evil; malice evilness; viciousness; sometimes anger,"adduwali(ya)-; /attuwal-/, MALUS-la/i-; /attuwalahid-/, MALUS-la/i-hi-tà-; /attuwalastarr(i)-/, MALUS-la/i-sa-tara/i HLuw. átuwa- (n.) ‘evil’ (nom.-acc.sg /atuwan=tsa/ MALUS-wa/i-za- ́ (TELL AHMAR 1 §19, TELL","idālu- ‘evil, bad’, ḪUL ",,?itala- 'evil' (HED E-I:492),,,,,,"Root *h1ed- ‘bite (> eat)’, Arm. erkn, ‘labour pains’, Gr. /04 ‘pain’ and OIr. idu ‘pain’. Kortlandt (1989:50) convincingly argues that these latter three words cannot be cognate to one another (Arm. erkn belongs with erk ‘toil’ ~ OHG furhten (Kortlandt 1976: 98), Gr. /04 reflects *h3ed- and OIr. idu ~ Goth. fita ‘to have labour pains’) and that therefore the reconstruction of a noun *h1edun ‘pain’ is unfounded. Rasmussen (1984: 144-57, taken over by Adams 1999:513) connects TochB yolo ‘bad, evil’ with the Anatolian forms."
Hitt. and PIE heart → be angry; Luw. heart → wish for,anger,feel with the whole heart,*k̑erd-im-e/o-,"*k̑ḗr, k̑érd-, *k̑r̥d- ","Ved. hŕ̥d- n. ‘heart’ (nom./acc. sg. hā́rdi, gen. sg. hr̥dás, dat. sg. hr̥dé, loc. pl. hr̥tsú, etc. [RV+]), su-hā́rd- adj. ‘having a good heart, friendly’ (AV+), sarva-hr̥dā́ instr. sg. ‘wholehearted’ (RV 10.160.3); cf. also hŕ̥daya- n. ‘heart’ (RV+), hŕ̥dya- adj. ‘cordial, beloved’ (RV+). – OAv. zərəd- n. ‘heart’ (instr. sg. zərədā-cā [Y 31.12]), YAv. zərəδaiia- n. ‘heart’ [+] Gk. κῆρ n. ‘heart’, dat. sg. κῆρι, κηρόθι adv. ‘with all the heart, heartily’ (Il.+), ἀ-κήριος adj. ‘without heart, lifeless, discouraged’; καρδία, Ion. καρδίη, ep. κραδίη f. ‘heart’ (Il.+) Arm. sirt ‘heart’ (i-stem: gen./dat. sg. srt-i, instr. sg. srt-i-w, gen./dat. pl. srt-i-c‘, etc.) Lat. cor, gen. sg. cordis n. ‘heart, spirit, soul’ (Enn.+); con-cors adj. ‘agreeing, harmonious’ (Naev.+), dis-cors ‘disagreeing’ (Cic.+), etc. [+]OIr. cride n. ‘heart, middle, love’ Goth. haírto n. ‘heart’, ON hjarta n. ‘id.’, OS herta n. ‘id.’, OHG herza n. ‘id.’, etc. OPr. seyr n. ‘heart’; Lith. širdìs f. ‘id.’, šerdìs f. ‘core, kernel, pith’; Latv. sir̂ds f. ‘heart, courage, wrath’ [+] OCS srŭdĭce n. ‘heart’, Russ. sérdce n. ‘id.’, Pol. serce n. ‘id.’, SCr. sȑce n. ‘id.’, etc.; OCS srěda f. ‘middle, community, Wednesday’, Russ. seredá f. (obs.) ‘Wednesday’, SCr. srijèda f. ‘id.’, etc. [+] TochA kri ‘will’, TochB käryāñ nom. pl. ‘hearts","to be angry; NB! in Luwian semantic shift to the meaning 'to wish', not 'to be angry'","/zart-/, za+ra/i- ‘heart’ (HL); zārt- ‘heart’ (CL); /zartiya-/, (COR)za+ra/i-ti-ia- ‘wish’ (HL)",kardimmi(ye/a)- be angry,kārti- ‘heart’,,,,,,,"The shift 'heart → be angry' is a common shift for many IE languages. Rieken (1999:110-111): the root *ḱerd- ‘heart’ served as the basis for a verb *ḱerd-e/o- ‘to be angry’. Of this *ḱerd-e/o- a -men- derivation *ḱerd-i-men- ‘anger’ is formed, of which another verb in *e/o- is derived: *ḱerd-i-mn-e/o-, which regularly yielded Hitt. kartimmie-. PAna *k̑ḗr, k̑érd- / *k̑r̥d-´ ‘heart’."
"to grumble, to shout, to make unpleasant noises → to be angry",anger,anger action,*k̑erP,*k̑r̥p-,"Lat. increpāre ‘to shout out, to upbraid’, Skt. kr̥pate ‘to lament’, Russ. kropotá ‘conflict, fight’ Gk καrxαλιiμos , 'swift, impetuous'",to be angry,"CLuw. zarpa/i- ‘to brush, scrape (?) but Tischler, denotes “jedenfalls ein Übel, das den Menschen befällt”. If this semantic field of zarpa/i- indeed is accurate, a connection with Hitt. karpi-, which particularly denotes ‘divine wrath’, is indeed possible.’ ( Клукхорст) ; CL zarp(i)- ‘one of the evils that befall the head goes back to Meriggi 1957 , но Едиана (Якубович) не согласны, считая что это какая-то часть головы . Сассвиль - борода ’;zarp(i)- ‘(part of the bed)’",karpi(ye/a)- ‘to be angry’; karpi- 'divine wrath'; karpiwala- 'furious',,,,,,,,"Puhvel (HED K:98) compares with other IE languages. Tischler (HEG A-K: 515) connects karpi- with CLuw. zarpa/i- that, according to Tischler, denotes “jedenfalls ein Übel, das den Menschen befällt”. If this semantic field of zarpa/i- indeed is accurate, a connection with Hitt. karpi-, which particularly denotes ‘divine wrath’, is indeed possible. On the basis of Hitt. karp- and Luw. zarp- we should reconstruct PAnat. *ḱrp-. Sassville (eDiAna): ""The Luwian noun zarp(i)- c., which represents a part of the head, and most probably the beard, could be traced back to a Proto-Anatolian root *k̑erP- or *zerP- (PAnat. initial *z- from palatalization of many PIE Ci̯-sequences)."""
get swallen → be angry,anger,anger,,*su̯elH-to swell,"Norv. svella to swell, Eng. swell. Lat. īnsolēscō",to be angry or arrogant,,"šulle-; šullai-,  šullēzi ‘to be arrogant’; šullatar, šullann- (n.) with the meaning; ‘a swelling state’ (in figurative meaning), ‘unjustifiable arrogance’ (:)šallakartae-",,,,,,,,"Molina: Indo-European correspondences include Norv. svella ‘to swell’, Eng. swell with the same meaning, and Lat. īnsolēscō ‘to become arrogant’, on the basis of which (EDHIL 778f) reconstructs a Proto-Indo-European suffixal form *sulH-eh1-. According to Melchert (2004), the development of an emotional meaning here is comparatively late, since remnants of the meaning 'swollen' can already be traced in Hittite (i.e. the trilingual KUB 4.4 obv. 2–9). The same semantical transition to the meaning of arrogance in Latin, therefore, is a parallel process. Melchert PIE *suelH- ‘to swell’."
drop → humidity → steam → smell → pleasant smell → pleasant → soothing,comfort,appeasement,*h1u̯ors-o-,"*h1u̯érs-s, *h1u̯érs-m̥, *h1u̯r̥s-ós","Skt. varṣá- ‘rain, Gr. ἐέρση ‘dew’",to appease (with pleasant aroma) (or sim.?),aršulāi-zi ‘to appease (with pleasant aroma) (or sim.?)’,"(GK) arsulai-; a similar verb *waršulāi-zi ‘appease’ (or sim.); waršula- ‘drop, humidity’, which is also attested with a secondary meaning ‘pleasant (appeasing) aroma’; warsiya- to appease (успокаивать); warsul- “calming” from wars(iya)- “to be satisfied”; a denominative warsulai- “to satisfy, set at ease”; waršiyatar (c.) ‘reconciliation(?)’: warša- (c.) ‘fog, mist’: ",,,,,,,,"Kloekhorst: comparison with Skt. varṣá- ‘rain’ and Gr. ἐέρση ‘dew’; PIE *h1u̯érs-s, *h1u̯érs-m, *h1u̯rs-ós; Tischler (HEG W): warsula- c. (hardly also warsul- n., l-stem) “drop; moisture, sweat,” and then the corresponding smell, namely on the one hand “(pleasant, sweet, anger-soothing) fragrance,” on the other hand “stench.” In HW (274), Friedrich translates this word as “Besänftigung, Beruhigung” and “Erfrischung” but adjusts this to “Tropfen; Saft; Duft” in HW Erg. 3: 36 (on the basis of Laroche 1963: 61), stating that, when used with eku-zi ‘to drink’, aršuli means “(im Tropfen), tropfenweise”. Güterbock (1986: 212) proposes to translate aršula- as ‘smell’, and states that “arsuli ekuzi should be translated “he drinks in the smell” and refers to “drinking the god” only by sniffing the aroma of the wine”. This translation, ‘smell, odor’, is taken over in CHD (e.g. the third context cited here is translated in CHD Š: 176 as ‘let the fragrant odor, (namely) the cedar and the oil summon you’). This works also fine for e.g."
"attractive ← excellent ← outstanding ← standing apart, cf. Fr. adv. à part ‘to one side, separate, aside’ → ModE adv. apart ‘id.’ vs. ModHG adv. or adj. apart ‘unusual, elegant, attractive’",love,good,*sEn(H)- ‘good (vel sim.)’,*sn̥ ‘apart; without’,"Ved. sanutár ‘apart’ (RV+), (?)sanitúr ‘id.’ (RV), sā́nu- sbst. ‘back’, OAv. hanarǝ (+abl.) ‘without’ , Gk. ἄνευ (+ gen.) ‘without’ (Il.+); Gk. ἄτερ (+ gen.) ‘without, apart from’ (Il.+) Lat. sine (+ abl.) ‘without’ (Plaut.+), PCelt. *sani‑, cf. OIr. sain ‘different’, OW han ‘(Lat.) alium, different; (prep.) of, from’, Goth. sundro ‘alone, apart’, ON sundr ‘asunder’, OE sundor ‘alone, apart’, OHG suntar ‘remote, separate, etc., TochA sne, TochB snai (+ obl.) ‘without’",well; good; to become good; goodness (slowly pushes away wassu- in Luwian),"san(n)awi, sa-na-wa; san(n)awiya-, sa-na-wa/i-ia-; san(n)awistarr(i)-, sa-na-wa/i-sa-tara/i-; san(n)awizza(/i)-?, sa-na-wa/i-za-",šanezzi- ‘excellent’; best,,sana- ‘(unknown)’,,,,,,"https://www.ediana.gwi.uni-muenchen.de/dictionary.php?lemma=1740 : Proto-Anatolian root *sEn(H)- with the semantics of ‘good’; Yakubovich: HLuw. /san(n)awi-/ might be a compound consisting of */san(n)-/ ‘well’ + /awi-/ ‘to come’, i.e. ‘well-come. IE etymology talks about semantics of ""alone, without"" --> to single out, set apart, isolate. D.S.: ‘excellent’ < ‘outstanding’ < ‘standing apart'/ Phonologically, especially Gk. ἄτερ ‘without’ speaks in favor of an aniṭ base *sen(‑), while PAnat. *sn̥‑nÉ‑H‑/*sn̥‑n‑H‑´ ‘to hide, conceal’ requires a laryngeal. There are various ways to explain the shape of this verb: it is either a factitive nasal present built on an adverb *sen‑h1 ‘apart’, [+] viz. *sn̥-nó-h1‑/*sn̥‑n‑h1- ‘to make apart’ [+] or, according to LIPP II:714, it has to be interpreted as a “praesens departiculativum”, viz. *sń̥h2o- derived from the univerbation *sn̥=h2o “(auch) ohne” ← *sen ‘apart’ + 2.*=h2o ‘also; and’ (LIPP II:334–345). [+] Although the problems regarding the phonological reconstruction of PAnat. *sn̥‑nÉ‑H‑/*sn̥‑n‑H‑´ ‘to hide, conceal’ cannot be solved yet, the underlying basis is reconstructable as a local adverb PIE *sen ‘apart’. [+]"
"honey → sweet → dear, beloved",comfort,honey-sweet,*melit- ‘honey’,*melit,"Gk. μέλι, gen. μέλιτος n. ‘honey’; Lat. mel, gen. mellis n. ‘honey’; Arm. mełr, gen. mełow (u-stem) ‘honey’; OIr. mil f. (i-stem) ‘honey’, OW, MW mel, OBret., MBret., MoBret. mel, OCorn. mel; Goth. miliþ n. ‘honey’ (acc. sg. miliþ haiþiwisk Mc 1.6); OE mildēaw, meledēaw n./m. ‘honeydew’, OS milidou n. ‘id.’, OHG militou n. ‘id.'; Alb. mjaltë ‘honey’. ","honey; sweet; to provide with honey, to honey-sweet","(HL) */mallid-/ ‘honey’; /mallidi-(ti)/ '(pass.) provided with honey, (metaphorical) very attractive (vel sim.)', ma-li-ri-i-mi-; maliddu; (CL) mallit- ‘honey’ (Čop's Law)",militess-; milit(t)- ‘honey’,*malit- ‘honey’,,mlttaime/i- honey-sweet’3116; *mltt- ‘honey’,,,,,"https://www.ediana.gwi.uni-muenchen.de/dictionary.php?lemma=393: PIE *mélit- means ‘honey’; Gk. μέλι, gen. μέλιτος n. ‘honey’; Lat. mel, gen. mellis n. ‘honey’; Arm. mełr, gen. mełow (u-stem) ‘honey’; OIr. mil f. (i-stem) ‘honey’, OW, MW mel, OBret., MBret., MoBret. mel, OCorn. mel; Goth. miliþ n. ‘honey’ (acc. sg. miliþ haiþiwisk Mc 1.6); OE mildēaw, meledēaw n./m. ‘honeydew’, OS milidou n. ‘id.’, OHG militou n. ‘id.'; Alb. mjaltë ‘honey’. (Sassville: HLuw. /mallidi-(ti)/ ‘to honey-sweet’ is likely to be a late formation because of the lenition of the alveolar in /mallid-i-/, which can only have occurred within the base noun. Although it would still be possible to assume that the denominative verb was remodeled in analogy to the base noun, the different semantics of the two putative cognates do not encourage this approach. Therefore, we suggest that Luw. /mallidi-(ti)/ is an inner-Luwian formation, which should not be reconstructed for Proto-Anatolian.)"
"to desire → to ask for → to receive → consent, favour",comfort,obedience,*nu- (tentative),*neu̯d- ‘to use’ or *neu̯dh- ‘to desire’ ?," Goth. niutan 'catch, gain', nuta 'fisher', un-nuts 'useless', ON njōta 'use, enjoy', Lith. naudá 'gain, profit', borrowed Finnish nauttia 'enjoy' (cf. German Nutzniessung 'usufruct, profit', OIr. Nuadu < *Newd-ont- 'Fisher'). Alternative etyma might be Ved. návate 'bellow, bray, shout; exult, acclaim, praise', Toch. AB nu- 'shout' (Neumann, apud Tischler, Glossar L-M-N 354]), or Gk. νεύω, Lat. nuō 'nod, assent'",obedience; contentment,nū(t)-;,"nū-n (nū-s, nū-t)",,,,,,,,"Puhvel (HED N:131-132): an inner-Hittite cognate may be nuzzi- in lahhu(wa)r-nuzzi- 'leaf crop, foliage supply' (vel sim.), tying in with *new-d- 'catch, gain, enjoy' (IEW 768), seen in Goth. niutan 'catch, gain', nuta 'fisher', un-nuts 'useless', ON njōta 'use, enjoy', Lith. naudá 'gain, profit', borrowed Finnish nauttia 'enjoy' (cf. German Nutzniessung 'usufruct, profit', OIr. Nuadu < *Newd-ont- 'Fisher'). Alternative etyma might be Ved. návate 'bellow, bray, shout; exult, acclaim, praise', Toch. AB nu- 'shout' (Neumann, apud Tischler, Glossar L-M-N 354]), or Gk. νεύω, Lat. nuō 'nod, assent'. Kloekhorst The word either occurs in lists of good things, always followed by ištamaššuar or tummantia-, or it occurs as an interjection (then nu-ú) in nu-ú halzai-i to call “nū”’. Since tummantia- is the Luwian correspondent to Hitt. ištamaššuar, and because of the one attestation with a gloss-wedge, some scholars regard nū- as a Luwian word, which would explain the dat.sg. form nūti: in Luwian, word-final -t- is dropped. This would mean, however, that a Luwian nū(t)- already in OH times was reshaped to Hitt. nom.sg. nūš and acc.sg.n n. Whether or not this is probable, the exact meaning of the word cannot be determined, which makes etymologizing impossible."
milk → poppy milk → drowsy → soothing,comfort,peace,*gl̥(n)ĝ-,*glo-n-ĝh-ei," Gk. γάλα(κτ)-, γλαγος 'milk', Hom. γλακτοφάγος 'milk-eating', Lat. lac(t)- 'milk' (the quintessential nutrient), Vedic jálāṣa- 'soothing' (< *galaĝso-?), Lith. glẽžnas (<*gleĝno-), ON klökkr (< *glenĝwo-) 'slack, tender'.",to calm down,,galank- / kalank-,,,,,,,,"Puhvel (HED K 18-20): PIE *g(l̥)l-n̥-ĝ-. Giiterbock (JAOS 103:161-162 [1983]) conjectured in KUB 24.7 I 45 a denominative verb 2 sg. pres. act. [ga]-la-ak-(a-ra-si in the sense of 'make drowsy'; he thought of galaktar as a plant or a vegetal substance and of a possible meaning 'poppy-milk', yet did not identify it outright with Papaver somniferum. kalank- resembles hamank- (q. v.) in having petrified nasal infixation, i.e. *g(l̥)l-n̥-ĝ-. Rather than assuming phonetic loss of /n/ in galaktar (thus e.g. Kammenhuber, MIO 2:418 [1954]; Kronasser, Etym. 1:89, 103), it may be a verbal noun based on the non-infixed stem. Possible cognates are Gk. γάλα(κτ)-, γλαγος 'milk', Hom. γλακτοφάγος 'milk-eating', Lat. lac(t)- 'milk' (the quintessential nutrient), Vedic jálāṣa- 'soothing' (< *galaĝso-?), Lith. glẽžnas (<*gleĝno-), ON klökkr (< *glenĝwo-) 'slack, tender'. Cf. Juret, Vocabulaire 11; Ivanov, Obsceindoevropejskaja 39; T. Burrow, W. B. Henning Memorial Volume 89-97 (1970); Oettinger, Stammbildung 149."
be silent → be calm,comfort,peace,,*gwr-éu̯-s-,"Lith. gùrstu 'subside, die down', Toch. A kur-, B kwär- 'become feeble, age', Goth, qaírrus 'gentle', qaírrei 'meekness', ON kvirr 'quiet, paceful', Arm. aorist koreay 'die out', korust 'extermination",calmly,"?/kar(a)i-(di)/, (“SIGNACULUM+*195”)ka-ri+i- ‘to sacrifice’",karuššiya-; karuššiyantili,,? karol(i)- ‘offering (?)’,,,,,,"Puhvel (HED K:116-117; 82-83): For etymology cf. s. v. kariya- 'stop, pause, rest' (82-83). Its uses parallel those of karussiyanu- (q. v.). The base verbs kariya- and karus(siya)- 'be silent' have similar intransitive meanings and probably the same etymology. Cf. Lith. gùrstu 'subside, die down', Toch. A kur-, B kwär- 'become feeble, age', Goth, qaírrus 'gentle', qaírrei 'meekness', ON kvirr 'quiet, paceful', Arm. aorist koreay 'die out', korust 'extermination'. Thus IE *gwer- in kariya- (*gwr̥-y-?) and karus- (*gwr-éw-s-?). For delabialization of *gw- before r see s. v. karap-. See also in eDiAna: https://www.ediana.gwi.uni-muenchen.de/dictionary.php?lemma=1226; https://www.ediana.gwi.uni-muenchen.de/dictionary.php?lemma=1269"
"to let go, to release → to relax → to calm, to soothe",comfort,peace,"PLuw lí-lEH-eh2- ‘pacification, soothing’","*leh1- ‘to diminish, permit, let'","Latin lētum n. ‘death’ (Plaut.+), lēnis ‘soft, mild, easy, calm, moderate’ (Plaut.+).; Old Irish ro·lá (< *-la-i̯e-ti) ‘puts, places, sets; Proto Germanic *lēwa- n. ‘occasion’ (Gothic lew), lēwijana- ‘to betray, deliver’ (Gothic lewjan, Old English lǣwan, Old High German, fir-, gi-lāen), Icelandic lómur ‘betrayal’. On Proto-Germanic *lētana- ‘to let, allow’ (Gothic letan, Old English lǣtan, English let, Old Norse láta, etc.) see below; Lithuanian liáuti (liáuja/-na, lióvė) ‘to cease; to stop sinning; to repent’, Latvian ļaũt (-ju/-nu, ļãvu) ‘allow, permit; grant freedom of action’, Old Prussian aulāut ‘to die’; Lithuanian lė̃tas ‘small, weak, slow; simple; cowardly, underhanded’, Latvian lȩ̃ts ‘light, reckless, cheap’, Lithuanian lė́nas ‘slow, calm, gentle, mild, weak (of drinks), (dial.) flexible’, Latvian lȩ̄̀ns ‘slow, calm, gentle, mild’.; Proto-Slavic *lěviti (Ukrainian leviti ‘weaken, diminish’, Czech leviti (obs., poet.) ‘facilitate, alleviate, diminish’, Serbo-Croatian léviti (dial.) ‘waste time, loaf ’), Old Church Slavonic lětь jestъ ‘it is allowed’, Proto-Slavic *lě̑nъ ‘lazy, slow’ (Old Church Slavonic lěnъ, Czech líný, Serbo-Croatian lȉjen, etc.).; Albanian lë ‘to let, leave (behind), allow, quit’, aor. la.","to pacify, to soothe, to appease","(CL) līla- ‘pacification(?), soothing(?)’",lela(e)-; lilaresk-; lila- (CL),,,,,,,,"https://www.ediana.gwi.uni-muenchen.de/dictionary.php?lemma=4024: The root *leh1- is reconstructed in LIV²:399 s.v. *leh1- as ‘to diminish, permit, let’ (“nachlassen, (zu)lassen”). Hittite lā-/l-(i) ‘to loosen, to release, to untie, to relieve, to remove (ailments)’ [+] , lela- c. ‘conciliation, pacification’, lelā(i)- ‘to pacify, soothe’, Luwian līla- c. ‘pacification, soothing’, Cuneiform Luwian līla-(ti) ‘to pacify, soothe’, lila(i)-(di) ‘to become calm’, Luwian in Hittite transmission lilā(i)-(mi) ‘to pacify, soothe’, etc.; Latin lētum n. ‘death’ (Plaut.+), lēnis ‘soft, mild, easy, calm, moderate’ (Plaut.+).; Old Irish ro·lá (< *-la-i̯e-ti) ‘puts, places, sets; Proto Germanic *lēwa- n. ‘occasion’ (Gothic lew), lēwijana- ‘to betray, deliver’ (Gothic lewjan, Old English lǣwan, Old High German, fir-, gi-lāen), Icelandic lómur ‘betrayal’. On Proto-Germanic *lētana- ‘to let, allow’ (Gothic letan, Old English lǣtan, English let, Old Norse láta, etc.) see below; Lithuanian liáuti (liáuja/-na, lióvė) ‘to cease; to stop sinning; to repent’, Latvian ļaũt (-ju/-nu, ļãvu) ‘allow, permit; grant freedom of action’, Old Prussian aulāut ‘to die’; Lithuanian lė̃tas ‘small, weak, slow; simple; cowardly, underhanded’, Latvian lȩ̃ts ‘light, reckless, cheap’, Lithuanian lė́nas ‘slow, calm, gentle, mild, weak (of drinks), (dial.) flexible’, Latvian lȩ̄̀ns ‘slow, calm, gentle, mild’.; Proto-Slavic *lěviti (Ukrainian leviti ‘weaken, diminish’, Czech leviti (obs., poet.) ‘facilitate, alleviate, diminish’, Serbo-Croatian léviti (dial.) ‘waste time, loaf ’), Old Church Slavonic lětь jestъ ‘it is allowed’, Proto-Slavic *lě̑nъ ‘lazy, slow’ (Old Church Slavonic lěnъ, Czech líný, Serbo-Croatian lȉjen, etc.).; Albanian lë ‘to let, leave (behind), allow, quit’, aor. la."
"right → oath; right → peaceful, positive → unite, reconcile",comfort,peace,PLyd Téks-os-to- or -ti-,"*dék̑s right’, PIE *dek̑- ‘to accept, perceive'","Ved. dákṣa- ‘able, fit’ Ved. dákṣiṇa- (RV+), YAv. dašina- ‘on the right, southern’ Gk. δεξίτερος ‘on the right’ (Il.+), Gk. δεξιός ‘on the right’ (Il.+), Myc. personal name de-ki-si-wo /deksiwos/ Lat. dexter ‘on the right’, Umbr. acc. sg. f. destram=e, etc., Osc. destrst ‘on the right’, Umbr. acc. sg. f. desua etc. ‘on the right’ OIr. dess ‘on the right; south’, Gaul place name Desso-briga, MW deheu ‘on the right, south’ Goth. taihswa ‘on the right’, OHG zeso, zesawer ‘id.’ Lith. dẽšinas ‘on the right’, OCS desnŭ ‘on the right’, etc. Alb. *djathë, djathtë ‘on the right’","right; to unite, reconcile",,"takš-(mi) ‘to unite, reconcile’; takšul- 'peace'",,tesast(i)-, tese- n. ‘oath’ ,,,,,"PIE *dek̑s- ‘right’ < PIE *dék̑‑os- ‘what is acceptable, pleasing, proper, right’; https://www.ediana.gwi.uni-muenchen.de/dictionary.php?lemma=2735 Ved. dákṣa- ‘able, fit’ Ved. dákṣiṇa- (RV+), YAv. dašina- ‘on the right, southern’ Gk. δεξίτερος ‘on the right’ (Il.+), Gk. δεξιός ‘on the right’ (Il.+), Myc. personal name de-ki-si-wo /deksiwos/ Lat. dexter ‘on the right’, Umbr. acc. sg. f. destram=e, etc., Osc. destrst ‘on the right’, Umbr. acc. sg. f. desua etc. ‘on the right’ OIr. dess ‘on the right; south’, Gaul place name Desso-briga, MW deheu ‘on the right, south’ Goth. taihswa ‘on the right’, OHG zeso, zesawer ‘id.’ Lith. dẽšinas ‘on the right’, OCS desnŭ ‘on the right’, etc. Alb. *djathë, djathtë ‘on the right’"
