semantic derivation,domain,semantics,PA_root,PIE,IE_cognates,translation,luw,hitt,pal,lyd,lyc_A,lyc_B,pis,sid,car,comments
god → Sun-god (Tiwat) → to call Tiwat (the Sun-god) as witness → swear → curse,enmity,curse,*di̯éu̯-/diu̯-´ ‘god’,*di̯éu̯‑/*diu̯‑´*dheu̯-,"Ved. dyáv-, div-´ m./f. ‘heaven, day; god of heaven, father heaven’ (RV+); YAv. gen. sg. diiaoš ‘of the (breed of) hell’ (Yt 3.13), OAv. fraidiuuā ‘always again’ (Y 32.14) Myc. gen. sg. di-wo /diu̯os/, dat. sg. di-we /diu̯ei̯/ m. ‘?Zeus’; Gk. (Hom.) nom. sg. Ζεύς m. god name ‘Zeus’, gen. sg. Διός, Ζηνός, dat. sg. Διί, Ζηνί, acc. sg. Ζῆν (cf. εὐρύοπα Ζῆν, e.g., Il. 8.206), Ζῆνα, Δία, voc. sg. Zεῦ (all Il.+) Arm. tiw ‘day’, abl. sg. towē, gen. dat. loc. sg. towǝnǰean, Lat. Iuppiter, Iouis m. divine name ‘Jupiter’ (Naev.+): nom. sg. Iūpiter, later Iuppiter, also Iouis (Enn., Acc.+), acc. sg. (inscr.) Diovem (Praeneste), Iouem, gen. sg. Diouos, Iouos, Diouo (Praeneste, Norba), Diouis, Iouis, dat. sg. Diouei (Falerii, Mesagne), Iouei (Praeneste, Spoleto), Iouī, abl. sg. Ioue, nom. pl. Iouēs (Cic.); Osc. nom. sg. dípatír, gen. sg. διωϝηις, iúveís, zoves (Presam. διπoτερες, Marr. ioues patres), dat. sg. διoυϝει, ζωϝηι, ιoυϝηι, diúveí, iúveí, iuveí (Mars. ioue); Umbr. voc. sg. iupater, di, dei, gen. sg. iuvip(atres?), dat. sg. iuve, iuue, iuvepatre, iuve patre, OIr. nom./gen. sg. die, día m. ‘day’, acc./dat. sg. dé, OW did m. ‘day’, diu sul m. ‘Sunday’, MW dyw, W dydd m. ‘day’, Corn. deth, Bret. deiz m. — OIr. indiu ‘today’, W heddiw, MCorn. hethew, MBret. hizio, NBret. hirio, ?OCS dŭždĭ m. ‘rainstorm, bad weather’, Russ. nom. sg. doždĭ, gen. sg. doždja, SCr. dȁžd, gen. sg. dàžda ‘id.","to swear, curse; swearing, cursing",tiwataniya-(ti); tiwataniya-; tiwataniyama-; tiwataniye/a-(mi); tiwatani-(ti) */tiw-/ ‘deity’,"šiu(n)- c. ‘god’, ", *tiu(n)- ‘god’,ciw- ‘god’,,ziwi ‘divinity (vel sim.)’,,,,"PIE *di̯éu̯‑/*diu̯‑´. Korolev & Shevoroshkin 1969a:527 (followed by Shevoroshkin 1971a:217 and Shevoroshkin 1977a:139, Gehrisch 2018a:87) suggests translating dat. sg. ziwi as ‘god’, which would be supported from the Indo-European perspective (the root *di̯eu-, as in Hitt. siu(n)- ‘god’, Lyd. ciw- ‘id.’). Melchert (DLL:138) finds the etymology unpersuasive, probably on account of the phonology. However, Sasseville 2021d brings evidence that the initial sequence *di-/di̯- in Lycian B would have behaved differently from Lycian A (adducing the personal name tiwi-θθeimija-/tiwi-θθeimi) and a potential second example of this sound law in Lyc. B zireime/i-. Thus, the Lycian B phonological development of this sequence would be parallel to the Lydian one. Ved. dyáv-, div-´ m./f. ‘heaven, day; god of heaven, father heaven’ (RV+); YAv. gen. sg. diiaoš ‘of the (breed of) hell’ (Yt 3.13), OAv. fraidiuuā ‘always again’ (Y 32.14) Myc. gen. sg. di-wo /diu̯os/, dat. sg. di-we /diu̯ei̯/ m. ‘?Zeus’; Gk. (Hom.) nom. sg. Ζεύς m. god name ‘Zeus’, gen. sg. Διός, Ζηνός, dat. sg. Διί, Ζηνί, acc. sg. Ζῆν (cf. εὐρύοπα Ζῆν, e.g., Il. 8.206), Ζῆνα, Δία, voc. sg. Zεῦ (all Il.+) Arm. tiw ‘day’, abl. sg. towē, gen. dat. loc. sg. towǝnǰean, Lat. Iuppiter, Iouis m. divine name ‘Jupiter’ (Naev.+): nom. sg. Iūpiter, later Iuppiter, also Iouis (Enn., Acc.+), acc. sg. (inscr.) Diovem (Praeneste), Iouem, gen. sg. Diouos, Iouos, Diouo (Praeneste, Norba), Diouis, Iouis, dat. sg. Diouei (Falerii, Mesagne), Iouei (Praeneste, Spoleto), Iouī, abl. sg. Ioue, nom. pl. Iouēs (Cic.); Osc. nom. sg. dípatír, gen. sg. διωϝηις, iúveís, zoves (Presam. διπoτερες, Marr. ioues patres), dat. sg. διoυϝει, ζωϝηι, ιoυϝηι, diúveí, iúveí, iuveí (Mars. ioue); Umbr. voc. sg. iupater, di, dei, gen. sg. iuvip(atres?), dat. sg. iuve, iuue, iuvepatre, iuve patre, OIr. nom./gen. sg. die, día m. ‘day’, acc./dat. sg. dé, OW did m. ‘day’, diu sul m. ‘Sunday’, MW dyw, W dydd m. ‘day’, Corn. deth, Bret. deiz m. — OIr. indiu ‘today’, W heddiw, MCorn. hethew, MBret. hizio, NBret. hirio, ?OCS dŭždĭ m. ‘rainstorm, bad weather’, Russ. nom. sg. doždĭ, gen. sg. doždja, SCr. dȁžd, gen. sg. dàžda ‘id.’ See in eDiAna: https://www.ediana.gwi.uni-muenchen.de/dictionary.php?lemma=2665"
to hate (basic verb) → to despise,enmity,hate,"*Peu̯KH- ‘to hate, to despise’",*bheu̯-g,"Gk. φεύγω, Lat. fugiō ‘flee’, Lith. būgti ",to hate; to despise; hateful,,"pukk-/ pugga- '‘to be hateful, to  be repulsive'",,,,puke-(ti) ‘to hate’,,,,"PAna *Peu̯KH- ‘to hate, to despise’ Kloekhorst 681 See Tischler (HEG P: 641f.) for the different etymological proposals, which I all find improbable: connections with *bheugh- ‘to bend, to flee’, with Skt. pyati ‘to stink’, with Lith. pìktas ‘bad, evil’ and with Goth. fauho ‘fox’ either have the wrong semantics or the wrong form (-kk- must reflect *-k-). Derivatives: pukkant- ‘hated, hateful, repulsive’ (nom.sg.c. pu-uk-kán-za (NH), nom.-acc.sg.n. pu-uk-kán (NH)), pukkanu-zi, pukkunu-zi (Ib2) ‘to cause (someone) to be hated, to create dissension’ (3sg.prs.act. pu-uk-ka4-nu-zi (NH), 2pl.pres.act. [p]u-ug-ga-nu-ut-te-ni (MH?/NS); part. pu-uk-ka4-nu-a-an-t- (NH); verb.noun pu-uk-ku-nu-mar (NS), gen.sg. pu-uk-ka4-nu-ma-aš (NS); impf. [pu-]uk-ka4-nu-uš-ke/a- (MH/NS)). PIE *bhew-g-, see Gk. φεύγω, Lat. fugiō ‘flee’, Lith. būgti ‘to be scared’."
"to hurt, to damage → to disapprove of",enmity,disapproval,*mork-iye/o- 'hurt',*mork-iye/o- 'hurt',"Skt. marc- ‘to hurt, to damage’, Lat. murcus ‘mutilated’",to disapprove,,markie/a-zi,,,,,,,,"According to Knobloch (1959: 39), followed by Oettinger (1979a: 346)), this verb belongs with Skt. marc- ‘to hurt, to damage’ and Lat. murcus ‘mutilated’. Puhvel (HED 6: 76) agrees with him and provides convincing parallels for a semantic shift of ‘to hurt, to damage’ to ‘to disapprove of’. Formally, we see a nice similarity between Skt. pres. marcáyati and Hitt. markiazi < *morkéyeti 'makes hurt'."
to be savage → to rage → to be hostile,enmity,hostile,kūr,*ĝhuh1r-ur-,"Ved. hvarate 'deviate', Avest. zurah- 'iniquity', OCS zverъ, Lith. zveris, Lat. furor 'rage', Skt. krūrá- ‘bloody’",hostile  ,,"kūrur- (n.) ‘enmity, hostility, war(fare)’, kūrura- (c.) ‘enemy’:",,,,,,,,"Puhvel (285) Somewhat like kallar- 'balefulness' (q.v.), kurur- is at the base an abstract neuter noun which has diversified a bit via appositional juxtaposition and specific derivation, partly on the model of Akk. nakdru. Despite Benveniste's despairing ""isole et inanalysable"" (Origines 37), kurur- was improbably connected with Skt. krura- 'bloody, cruel', Lat. eruor 'blood', crudus 'raw' (etc.) from H. Holma (Jour- nal de la Soeiete finno-ougrienne 33.1:66 [1916]) and Hrozny (Heth KB 137) to Sturtevant (Lg. 6:217 [1930], Comp. Or.1 32, Comp Gr2 56-7) and beyond, possibly as a dissimilatory *krurur (Kronasser, Etym. 1:103). Sturtevant himself launched a dubious parallel derivation of kurur- from kucr- 'cut' (Comp. Gr.] 119, 148) which lin-gered through Laroche (BSL 58:69 [1963]), Carruba (Beschwo-rungsritual 53, with wrong reference to Sturtevant), Gusmani (Lessico 117), and Oettinger (Stammhildung 120). Van Windekens (Arch.Or. 57:336 [1989]) thought of Gk. Papvq 'heavy'.H. Eichner's brief suggestion (MSS 31:75, 99 [1973]) kurur < *ghwr-\\r 'crookedness, deceit' and adduction of Ved. hvarate 'deviate', Avest. zurah- 'iniquity' was featured by Mayrhofer {KEWA 3:620) but remains semantically dubious and under the lingering cloud of Lai. falio 'deceive' and IE *gh\vel- (IEW489-90) as etyma of the Indo-Iranian words. Mayrhofer {KEWA 3:620) connected *ghwer- 'walk crookedly' with *gh\ver- 'wild beast' (Gk. Ofjp, OCS zverL Lith. zveris, Lat.ferns). This is very doubtful, but *gh\ver- itself may hold the clue to kurur-, with a root-meaning 'be savage, rage'; a *gh\vr-\vr 'savagery' may hence stand as the proto-form underlying kurur-. It might even be worth considering whether *gh\vr-wr holds the key also to the reshaped Lat. furor 'rage', since other etymologies for furo 'to rage' (*bhuro, *dhuso, *dhuro) are all flawed (see Walde-Mofmann and Ernout-Meillet s. v.), leaving the possibility of *ghuro (cf. fundo < *ghud-no). Semantically kurur- and furor make sense as referring originally to warlike fury, same as Irish ferg and German Wut (cf. the glossing of Wodan by 'Furor' [Adam of Bremen 4.26])."
"to push away → forsake, abandon → neglect → be unfriendly",enmity,hostile,*paskw-,,"Goth. af-skiuban ‘push away, forsake, abandon’","aloofness (?), unfriendliness (?) hapax",puškantatar; puškant(i)- HLuw. paskw- ‘to neglect’; pa-sà-REL-i (/paskwi/)'‘neglects’',"puškant(i)- ‘aloof (?), unfriendly (?); ’paškuwae-, pašku- (ант  (ḫuišnu-) 'aloofness'; V pašku- ‘to reject, to ignore; to neglect; to remove’ (EDHIL 651-652); V pasku(wai)- ‘abandon, forsake, dismiss, disown, discharge’ (HED Pa:190-192)",,,,,,,,"Kloekhorst (651): pašku-zi (Ib1 > Ic2) ‘to reject, to ignore; to neglect; to remove’: The original stem is pašku-, which is visible in the MS forms paškutta and paškuanzi. Especially the form 3sg.pret.act. paškutta (and not **paškut) shows that we have to phonologically interpret this stem as /paskw-/. In NH times, the trivial transition into the atrae-class yielded forms like paškunun and paškuwait. In HLuwian, we find a verbal form pa-sà-REL-i ‘neglects’ which likely is to be interpreted as /paskwi/ (note the i-inflection), which would indicate that the PAnat. form was *Paskw- (since *gw would have disappeared in Luwian). This is supported by the PN f Pa-aš-ku-a-am-mi-iš (KUB 31.59 ii 4), which formally is to be interpreted as a Luwian participle of a stem pašku(a)-. Kloekhorst knows of no IE cognates, however. Puhvel (HED Pa:190-192), A. Carnoy (La Nouvelle Clio 6: 231 [1954]) suggested *pa-sqeu- (comparing Lat. obscūrus), pasku- joins pastar(iya)- (q. v.) in attesting pa- matching Hitt. pe-. A verb pa-sku- resembles Goth. af-skiuban ‘push away, forsake, abandon’."
"to leave, abandon → defiecient → defective → not right → sin",enmity,offence,*u̯eh2š-dē- (assimilation is possible h-s > ss?) ,*h1u̯eh2-š-dheh1,"Ved.  ūná- ‘wanting, deficient, defective’ (AV+; cf. án-ūna- ‘unfailing, inexhaustible’ RV [+] ), Av. ūnā- ‘deficient (offering)’, Arm. ownayn ‘empty’,  Lati. vānus ‘empty’,  Proto-Germanic *wanaz ‘deficient, lacking (in)’ (Gothic wans, Old Norse vanr, Old English, Old High German wan ","sin, failure; offense; sinful, offensive (deed)",wašku(i)-; waškui(t)-; wašku(wa)llimma/i; waškuwan-; wašt(a)-,"waštul- (var. uštul-) wašta-/wašt-(ḫi) ‘to sin, offend’ wašku(i); waštul- /waštanu-",,,,,,,,"*h1u̯eh2- ‘leave, abandon, lose’ Vedic vā́yati ‘fades away, becomes empty, lacks, loses’ and Ancient Greek ἐάω ‘abandon, leave behind, leave alone’ (whence ‘let be, allow, permit’; see Nussbaum 1998b:79). An absolute intransitive meaning ‘quit, fail, be deficient’ (see Nussbaum 1998b:81–83) is suggested by Latvian vâjêt ‘become weak’ and a couple of nominal formations, including adjectives in *-(o)no- such as *h1uh2-no- > Vedic ūná- ‘wanting, deficient, defective’ (AV+; cf. án-ūna- ‘unfailing, inexhaustible’ RV [+] ), Avestan ūnā- ‘deficient (offering)’, Armenian ownayn ‘empty’, *h1u̯eh2-no- > Latin vānus ‘empty’, *h1uh2-ono- > Proto-Germanic *wanaz ‘deficient, lacking (in)’ (Gothic wans, Old Norse vanr, Old English, Old High German wan, etc.). It is not surprising that formations in this semantic range can adopt meanings of negative value judgment (e.g., Latin vānus ‘empty’ and ‘false, lying, deceptive, delusive, untrustworthy’, and further English fail and failure, German fehlen ‘to be missing’ and Verfehlung ‘wrongdoing, transgression’). In this regard, it is important to note that Hittite wašta-/wašt-(ḫi) also means ‘to miss (a target)’ (cf. Puhvel 1992a:7; HEG W-Z:406), which might preserve the older meaning. Kloekhorst 931 Derivatives: wašdulae-zi (Ic2) ‘to offend’ wašdulaant- ‘offense’ PIE *usTh2/3-éul This word clearly is cognate with ašta-i / ašt- ‘to sin’ (q.v.). Although the bulk of the attestations of this word show a stem wašdul-, the oldest ones show wuštul-. This latter stem therefore must have been the original one. Apparently, the zero grade stem ušt- of uštul- was replaced by ašt- in the early MH period, probably in analogy to the full grade stem of the verb. The fact that we find an original zero grade root in this noun implies that the suffix -ul- must have been accented, which is supported by the spelling a-aš-du-ú-li, which must reflect *-éul-i. See s.v. ašta-i / ašt- for further etymology. Note that despite the one NS commune form acc.sg.c. ašdulin all other forms clearly indicate that the word is neuter."
"to press, to apply pressure physically → to press / put pressure on someone psychologically",enmity,oppression,*dmaHs-/*dm̥Hs- '1. to press (physically); 2. to oppress (psychologically)',*dm̥‑né/n‑h2‑,"Gr. εdαmασα ‘to tame’, OIr. damnaim ‘to tie up’, Skt. damyáti ‘to tame’, Lat. domre ‘to tame’",to (op)press,damaš-ti,tamāšš-/tame/išš-(zi) ‘to (op)press’ damešḫai-   tamas,,,,,,,,"*dméh2-s-ti / dmh2-s-énti. *dmaHs-/*dmHs- PIE n‑pres. *dm̥‑né/n‑h2‑, cf. Ved. damāyáti ‘to tame, oppress’ (refashioned, EWAia I:698, Grassmann 1996a:576f.), Gk. δάμνημι, Dor. δάμνᾱμι ‘to tame, subdue, conquer (esp. of horses)’ (GEW I:346, DELG:250f., EDG:301, LSJ:368), OIr. damnaim ‘to subdue, break in (of horses)’ (eDIL s.v. 2.damnaid, EDPC:88) PIE iter. *domh2‑éi̯e/o‑, cf. Ved. damáyati ‘to tame’, Khot. dīm‑/danda- ‘to tame’, Oss. domyn/dæmun ‘to tame, exhaust, request’ (EWAia I:698, Grassmann 1996a:576f., EDIV:55, Abaev I:365f.), Lat. domāre ‘to tame’ (WH I:367f., EM:182, EDLIL:178), PGerm. *tamjan- (Goth. ga‑tamjan [hapax, Mk.5.4], ON temja ‘to tame’, OHG zemman) [+] (EDPG:508, GED:149f., Bjorvand & Lindeman 2000a:922, Kluge & Seebold 2011a: 1001, Heidermanns 1993a:589f.) Celtic OIr. daimid ‘to endure, suffer’ (eDIL s.v. daimid, EDPC:89f.) Regarding the Anatolian semantics, the meaning of PAnat. *dmaHs- ‘to press (physically)’ [+] is primary, and ‘to oppress (psychologically)’ secondary, [+] cf. Buck 1949a:575. The meaning ‘to tame’ of PIE 2.*demh2- can be established only for a fairly recent stage of Core IE, while the original meaning has to be approximated as ‘to press (physically)’.2. Connection with PIE *dem- ‘to build’ A connection of PIE 2.*demh2- ‘to press, oppress’ (contra LIV²:116f., cf. above) with PIE 1.*dem- ‘to assemble, build’ is frequently assumed. [+] A factitive relation seems plausible: ‘to build’, ‘house’ → ‘to make appropriate for living by a house’ > ‘to domesticate, tame’. However, since the primary meaning of PIE 2.*demh2- is ‘to press (physically)’, this development is impossible. In order to connect both roots, the original meaning of 1.*dem- ‘to build, assemble’ can hence be approximated as ‘to press on, compress (clay vel sim.)’, [+] thus: (early) PIE *dem- ‘to press (physically)’> PIE 1.*dem- ‘to press on, compress (clay vel sim.)’ > ‘to build, assemble’ (cf. Lyd. tam- ‘to build’)→ PIE 2.*demh2- ‘to press (physically)’ (cf. PAnat. *dmaH‑s‑) > ‘to oppress (cf. PAnat. *dmaH‑s‑); to tame (cf. Gk. δάμνημι)’ The meanings ‘to build, assemble’ and ‘to (op)press’, might exhibit a polysemy that already existed in PIE. For the root-final *‑h2- in PIE 2.*demh2- ‘to press’, cf. below. Kloekhorst 825 damme/iš- (c.) ‘damaging, act of violence, punishment’: IE cognates: see s.v. tamšš-zi / tame/išš-. Gr. 0‘to tame’, OIr. damnaim ‘to tie up’, Skt. damyáti ‘to tame’, Lat. domre ‘to tame’.PIE *demh2-sh2ó- See Otten 1973: 52 for attestations. This noun and its derivatives are almost consistently spelled with the sign DAM. Although in NS texts this sign can be read dax as well (see e.g. tamšš-zi / tame/išš- and ištamašš-zi (s.v. (UZU)ištman- / ištamin-)), its usage in MS texts and especially the OS attestation t-m-[m]i-iš ha-an-ta-an show that all attestations should be read with geminate -mm-. We find spellings with -i- as well as -e- in MS texts already, which points to a phonological interpretation /taMsH-/. Already Götze (1930: 179) connected damme/iš- with the verb tamšš-zi / tame/išš- ‘to oppress’. Although this is generally accepted, the fact that damme/iš- shows geminate -mm-, whereas tamašš-zi / tame/išš- does not, is significant. As I have argued s.v. tamšš-zi / tame/išš-, this verb has to be phonologically interpreted /tmS-/, /tmS-/ and goes back to *dméh2-s-ti, *dmh2-s-énti. The noun damme/iš- must be phonologically interpreted /taMsH-/, however, with a real vowel -a- between d- and -mm-. This vowel can only reflect a real PIE vowel. I therefore reconstruct *demh2-sh2ó-. For the development of *CeRHsC > CaRRsC compare kallišta /káLsta/ ‘called’ < *élh1st(o). For the suffix -ša- compare e.g. palza()a-, ameša-, teša-, etc. Иванов 175"
to speak → to curse,enmity,curse,*tér‑/*tr̥- to speak’ (for the verbs with the meaning of cursing -- reduplication),*ter- 'to speak',"Skt. tārá- ‘loud, shrill, pervasive’,  Gk. fut. 1sg. τετορήσω ‘to proclaim in shrill piercing tones’ (hapax, Ar.Pax381), τορός ‘loud, shrill, clear; fast, agile’ (A+)  OIr. torm ‘sound, tumult’Lith. tariù, tarýti ‘to speak, say’, OPr. tattrātwei, etc. ‘to answer’, acc. sg. tārin f. ‘voice’ (III) TochB m‑part. tärraskemane ‘pleading, imploring’ or ‘comforting, soothing’ (hapax) ",to curse,tātariyamman- ‘curse’ /*tadariya-(i)/ ‘to curse,tē-/tar-(mi) ‘to speak’,dar- ‘to speak(?)’,,dderije-(ti) ‘to curse (?)’,,,,,"Skt. tārá- ‘loud, shrill, pervasive’ [+] Gk. fut. 1sg. τετορήσω ‘to proclaim in shrill piercing tones’ (hapax, Ar.Pax381), τορός ‘loud, shrill, clear; fast, agile’ (A+) [+] OIr. torm ‘sound, tumult’Lith. tariù, tarýti ‘to speak, say’, OPr. attrātwei, etc. ‘to answer’, acc. sg. tārin f. ‘voice’ (III) TochB m‑part. tärraskemane ‘pleading, imploring’ or ‘comforting, soothing’ (hapax) PIE *terh1- ‘to drill, rub’ (LIV²:632f.) or PIE *terh2- ‘to pass, cross’"
loss → betrayal → humiliation,enmity,oppression,,"*léh1u-ri-s, *léh1u-ri-m, *lh1u-réi-s ?","Goth. lewjan ‘to betray’, Lith. liáutis ‘to stop’, Ukr. livýty ‘to omit, to neglect’",humiliation,,"luriyaḫ- 'to humilate, embarrass'",,,,,,,,"Kloekhorst 534 luri- (c. > n.) ‘loss of honour, disgrace, humiliation; financial loss; shortage(?)’ (Sum. I.BÍ.ZA): Derivatives: lriatar (n.) ‘disgrace, humiliation’ (nom.-acc.sg. [l]u-u-ri-a-tar (NH)), lria-i (IIb) ‘to humiliate, to disgrace’ (3sg.pret.act. lu-ri-a-a-ta (NH),2sg.imp.act. lu-u-ri-a-a (NH), 3pl.imp.act. lu-ri-a-a-a-an-du (OH/NS), impf. lu-u-ri-a-a-i-eš-ke/a- (NH)). PIE *léh1u-ri-s, *léh1u-ri-m, *lh1u-réi-s ? See CHD L-M: 86f. for attestations. About the semantics it states: “the unifying idea seems to be ‘loss’, whether of possessions, honour or station”. The word shows many plene spellings of the -u-, for which predominantly the sign U is used. Twice, we find the sign Ú, however. Either these two instances are scribal errors, or we are dealing with traces of an original ablaut between lu-u-ri- = /lóri-/ and lu-ú-ri- = /lri-/ (see § 1.3.9.4f and below). The oldest attestations show commune gender, whereas the one neuter form is attested in a NH text only. According to Puhvel (HED 5: 123), l ri- is to be analysed as a deverbal noun in -ri-, just as edri- ‘food’, šri- ‘shape’ etc. that are derived from ed-zi / ad- ‘to eat’ and eš-zi / aš- ‘to be’ respectively. If this is correct, we may think of a connection with the verbal root *leh1-, which shows a u-present in e.g. Goth. lewjan ‘to betray’, Lith. liáutis ‘to stop’, Ukr. livýty ‘to omit, to neglect’. Perhaps lu-ú-ri- = /lri-/ reflects *leh1u-ri-, whereas lu-u-ri- = /lóri-/ reflects *lh1u-ri-."
to despise ← to diminish → small,enmity,oppression,*tep-,*dhébh-u-,"Skt. dabhrá- ‘little, small, deficient’, dabhnóti ‘to deceive, to hurt’, ádbhuta- ‘unerring, wunderful’, GAv. dbnao- ‘to deceive’","to diminish, to despise","tāpa/i- ‘bad, shoddy, of minor value (?)’, (cf. Hitt. tēpu- ‘small’ for a possible etymological connection assumed here), https://www.ediana.gwi.uni-muenchen.de/dictionary.php?lemma=3566; tapašša- ‘illness (?)’, taparu- 'humiliation'",tepnu-; tepawesk- 'humiliate'; tēpu-/tēpau̯- 'small',,,,,,,,"Kloekhorst (869): from tēpu- / tēpau- (adj.) ‘little, few’: IE cognates: Skt. dabhrá- ‘little, small, deficient’, dabhnóti ‘to deceive, to hurt’, ádbhuta- ‘unerring, wunderful’, GAv. dbnao- ‘to deceive’.PIE *dhébh-u- This noun and its derivatives are predominantly spelled te-e-p° and te-p° (both in OStexts already). Twice, we find an aberrant spelling, namely [t]i-e-pu (OS) andz[e-]-pu (OS), but these can hardly be anything else than scribal errors. This adjective, which has to be phonologically interpreted /tébu- / tébau-/ has since Marstrander (1919: 150) generally been connected with Skt. dabhrá- ‘little, small, deficient’. At the same time Hrozný (1919: 1464) connected Hitt. tepnu-zi with Skt.dabhnóti ‘to deceive’, which goes back to *dhebh-neu- (but note that GAv. dbnao- = /dbnao-/ shows the most archaic formation, namely *dbh-neu-). A u-stem, as in Hitt. tpu-, is found in Skt. ádbhuta- ‘unerring, wunderful’ (*.-dhbh-u-to-) as well.See s.v. tepšu- / tepša- for a nominal derivative reflecting *dhebh-su-. See also Luw. taparu- 'humiliation' (https://www.ediana.gwi.uni-muenchen.de/dictionary.php?lemma=3567)."
hostility → revenge,enmity,revenge,*k(h2)et ‘hostility (vel sim.)’,*k̑h2et-(e)u-,"OIr. cath‘strife, battle’",hostility (?); to be enemies,"/katt(i)-/, ka-ti-i-; *katt(i)- hostility (?)’; kattawatnalla/i- ‘vengeful; plaintiff; revenger’","kattu- ‘enmity, strife’; kattuwae-, kattawatar  'to be aggrieved'; katterraḫḫ-",,,,,,,,"Kloekhorst (466): PIE *k̑h2et-(e)u- ? Derivatives: kattuae-zi (Ic2) ‘to be aggrieved(?)’ (3sg.pret.act. kad-du-u-a-i[t] (OH/NS), kad-du-a-i-i[t] (OH/NS)), kattatar / kattawann- (n.) ‘aggrievedness, enmity’ (nom.-acc.sg. kat-ta-a-a-tar (OH/NS), kat-ta-a-tar (OH/MS), gen.sg. kat-ta-a-an-na-aš (OH/NS)), kattaannalli- (adj.) ‘vengeful’ (nom.sg.c. kat-ta-a-‹an-›na-al-li-iš (MH/NS)). See Puhvel HED 4: 138f. for attestations. Although the basic noun kattu- is only attested once, on the basis of the derivatives kattuae- and kattaatar we can set up an adjective *kattu- / katta- ‘aggrieved, inimical’. Laroche (1965: 51) compared these words to Gr. ‘spite, anger’, which is usually connected with OIr. cath‘strife, battle’ (which reflects *katu- as in the personal names Gaul. Catu-riges, OHG Hadu-brand), MHG hader ‘fight, struggle’ and Skt. sátru- ‘enemy’. These words point to a root *h2et- (laryngeal needed to explain OIr. -a-), which would mean that Hitt. kattu- / katta- reflects *h2et-eu-. Note that this implies that CLuw. kattawatnalli- cannot be genuinely Luwian, since * > Luw. z-, and therefore must be an adaptation of the Hittite word. https://www.ediana.gwi.uni-muenchen.de/dictionary.php?lemma=3777"
"high → eminent, powerful → arrogant",enmity,revenge,*serk-,*serk‑,"TochB särk- ‘to be better than’, Lat. sarci ‘to patch up, to mend'","vengeful, something negative, angry","šarkiwal(i), šarkatt- CLuw. *šark-.","šark- /šarkiwalli- 'eminent, illustrious, powerful'",,,,,,,,"Kloekhorst (734): šarku- / šarga- (adj.) ‘eminent, illustrious, powerful’, (c.) ‘an eminent person’. IE cognates: TochB särk- ‘to be better than’, Lat. sarci ‘to patch up, to mend’. PIE *sr-(e)u- or *sor-(e)u- This adjective is often translated ‘high in status’(cf. also CHD), which goes back to Juret (1942: 43) who assumed an inner-Hittite connection with šar ‘upwards’ and šr ‘on top’. This connection cannot be correct, however, and šarku- / šarga- therefore should be translated ‘eminent, illustrious, powerful’ without semantically linking it to ‘high’. We are clearly dealing with an u-stem adjective derived from a root šark-, which probably is found as such in the verb šarkiške/a- ‘to be good’ < *šark-ške/a-. Note that the editors of CHD (Š: 267) translate this verb as “to ascend”, which they admit to have based “on the supposed link to šarku- ‘high, eminent’”. Moreover, in order to illustrate this meaning they only cite one context, KUB 24.7 iv 25-26, which is broken and therefore non probative. The other context in which this verb occurs is much clearer (for the reading šar-[k]i-iš-ke-ši, cf. šarku- d UTU-u- ‘eminent Sun-god’ in ibid. i 15, 18, 58)."
