semantic derivation,domain,semantics,PA_root,PIE,IE_cognates,translation,luw,hitt,pal,lyd,lyc_A,lyc_B,pis,sid,car,comments
desire (already in PIE) → plot (out of desire); desire → love,desire,love,"*kéu̯p-/kup- ‘to desire, plot (out of desire)’ ",*keu̯p-,"Vedic kopáyati ‘moves, shakes, agitates’ (RV), Sanskrit (epic) kupyati ‘is excited, agitated, boils with rage, is angry’, kopa- m. ‘fury, passion, wrath, anger’. Gk. Κύπρος f. ‘Cyprus’ (if ‘beloved [sc. island]’), Κύπρις, -ιδος ‘Cypris (a name of Aphrodite)’ (if ‘beloved one’). Lat. cupiō, cupere, cupīuī, cupītum ‘desire, long for’ (Naev.+), cupidus ‘having a strong desire, eager, anxious; greedy; ambitious; wanton’ (Pl.+), cupīdō, -inis f. or m. ‘passionate desire, lust, greed; Cupid’ (Pl.+), acc.pl. cuppēs ‘delicacies’ [+] , cuppēs, -ēdis ‘gluttonous’ (Pl.+), cuppēdia, -ōrum n. pl. ‘delicacies’ (Pl.+), cuppēdo ‘desire; gourmanderie’ (Varro+), dea Cupra (name of a goddess worshipped at Cupra in Picenum, perhaps identifiable with the Bona Dea), Umbr. cubrar matrer ‘Mother Cupra’, Sabin. ciprus ‘good’ (acc. to Varro L. 5.159), SPicen. kuprí, qupíríh adv. ‘?’ OIr. ad·cobra ‘desires, wishes’, accobor n. ‘desire, wish; greed; lust’ (*ad-kupro-), MIr. mil-chobur ‘bear’ < *‘desiring honey’ (cf. mil ‘honey’), PN Ól-chobar (cf. ól ‘drinking (alcohol)’), Con-chobar (cf. cú, gen. sg. con ‘dog’). PGmc. *heufana- ‘to wail, lament, grieve’ (Goth. hiufan, OE hēofan, OHG hiofan, hioban), OE hēof, hēaf ‘grief, sorrow’, ON hjúfra ‘to wail, weep’. Toch. B kāwā- ‘desire, crave’, kāwo, obl. kāwa ‘desire’; Toch. A kāpā- ‘well up, be greedy’ (but only if the verb is denominal and based on an *-eh₂-stem with schwebeablaut, viz. *ku̯opeh₂- > Proto-Toch. *kæpā- whence (with ā-umlaut) Toch. B kāwo).",to desire,"(GK) kup- ‘to plot, scheme’; kupiyat(i)-;; kupiyatalla/i-, kukupalatar; †kupiyatar","kup- 'plan, premeditate, scheme, plot, conspire, practise deceit', kup(i)yati- (c.) 'premeditation, scheme, plot', kupiyatalli- 'scheming, plotting, conspiring', kukupalalar (n.) 'advance plotting, malice aforethought, premeditated deceit' kupiškezzi?",,*kup- ‘to desire’,,"*kup- ‘to desire’ kupri-(ti) ‘to love, choose kuprime- ‘chosen (sacrifice",,,,"PAnat. *kéu̯p-/kup-´ ‘to desire, plot (out of desire)’; https://www.ediana.gwi.uni-muenchen.de/dictionary.php?lemma=3216. Vedic kopáyati ‘moves, shakes, agitates’ (RV), Sanskrit (epic) kupyati ‘is excited, agitated, boils with rage, is angry’, kopa- m. ‘fury, passion, wrath, anger’. Gk. Κύπρος f. ‘Cyprus’ (if ‘beloved [sc. island]’), Κύπρις, -ιδος ‘Cypris (a name of Aphrodite)’ (if ‘beloved one’). Lat. cupiō, cupere, cupīuī, cupītum ‘desire, long for’ (Naev.+), cupidus ‘having a strong desire, eager, anxious; greedy; ambitious; wanton’ (Pl.+), cupīdō, -inis f. or m. ‘passionate desire, lust, greed; Cupid’ (Pl.+), acc.pl. cuppēs ‘delicacies’ [+] , cuppēs, -ēdis ‘gluttonous’ (Pl.+), cuppēdia, -ōrum n. pl. ‘delicacies’ (Pl.+), cuppēdo ‘desire; gourmanderie’ (Varro+), dea Cupra (name of a goddess worshipped at Cupra in Picenum, perhaps identifiable with the Bona Dea), Umbr. cubrar matrer ‘Mother Cupra’, Sabin. ciprus ‘good’ (acc. to Varro L. 5.159), SPicen. kuprí, qupíríh adv. ‘?’ OIr. ad·cobra ‘desires, wishes’, accobor n. ‘desire, wish; greed; lust’ (*ad-kupro-), MIr. mil-chobur ‘bear’ < *‘desiring honey’ (cf. mil ‘honey’), PN Ól-chobar (cf. ól ‘drinking (alcohol)’), Con-chobar (cf. cú, gen. sg. con ‘dog’). PGmc. *heufana- ‘to wail, lament, grieve’ (Goth. hiufan, OE hēofan, OHG hiofan, hioban), OE hēof, hēaf ‘grief, sorrow’, ON hjúfra ‘to wail, weep’. Toch. B kāwā- ‘desire, crave’, kāwo, obl. kāwa ‘desire’; Toch. A kāpā- ‘well up, be greedy’ (but only if the verb is denominal and based on an *-eh₂-stem with schwebeablaut, viz. *ku̯opeh₂- > Proto-Toch. *kæpā- whence (with ā-umlaut) Toch. B kāwo). It is difficult to establish the precise meaning of the root *keu̯p- in PIE. What is clear is that it referred to an intense feeling or emotion, probably ‘desire’ [+] , from which all other attested meanings may be derived (negative desire > fury in Indic, wistful desire > grief in Germanic, desire > plot (out of desire) in Anatolian Puhvel 257 Etymologically the connection with Lat. cupio 'crave' (first inW. Petersen, Arch. Or 9:205 [1937]) makes reasonable semantic sense (cf. rerwn novarum cupidus 'revolutionary') and may be strengthened syntactically by the regular -kan kup- besides Lat. con- -cupio, con-spiro. The absence of plene-spellings of medial stops does not militate, in view of Luwoid character (cf. Cop, Die Sprache 3:148 [1956]; Oettinger, Stammbildung 204). Less likely is Cop's (ibid. 147) adduction of the West and North Germanic etymon of Eng, hope which seems an isolated innovation (vs. Goth. wenjan 'to hope'; semantically there is a gap between the wishful thinking of 'hope' and the willful planning of kup-)."
"wish → demand, ask for",desire,desire,"*u̯ek̑(-i̯e/o)- ‘to request, wish’",*u̯ek̑-,"Ved. vaś- ‘to wish, want’ (RV [pres. 3sg. váṣṭi, 1pl. uśmási, ptc. uśánt-, fem. uśatī́-, etc.]+); Av. vas- ‘to wish’ (pres. 3sg. OAv. vaštī, 1pl. OAv. usǝ̄mahī, ptc. YAv. usaṇt-, fem. usaitī-, etc.). Gk. ptc. ἑκών (Cret, Locr. ϝεκών), fem. ἑκοῦσα, ntr. ἑκόν ‘readily, wittingly, purposely, as far as depends on one’s will, as far as concerns one’","to wish, request; requested, wanted (?)","*/wazz-; wazz(a)i-(di)(?)/, (“*69”)wa/i-zi-; /wazza-/, (“*69”)wa/i-za-; wazzaimma/i-; wazzi-(ti)","wēkk-/wek-(mi) ‘to request, wish; to ask for’ wewak - многократно требовать (= вед vavaś) wesk, uekuwar -требование,  отлож падеж - wekuwarraz, древняя гнтераклиза*- wer-|wen",,,"*wezz- , wezzeime/i- ",,,,,"*u̯ek̑(-i̯e/o)- ‘to request, wish’; PIE root *u̯ek̑- is ‘to wish Иванов стр 70. https://www.ediana.gwi.uni-muenchen.de/dictionary.php?lemma=1362. Ved. vaś- ‘to wish, want’ (RV [pres. 3sg. váṣṭi, 1pl. uśmási, ptc. uśánt-, fem. uśatī́-, etc.]+); Av. vas- ‘to wish’ (pres. 3sg. OAv. vaštī, 1pl. OAv. usǝ̄mahī, ptc. YAv. usaṇt-, fem. usaitī-, etc.). Gk. ptc. ἑκών (Cret, Locr. ϝεκών), fem. ἑκοῦσα, ntr. ἑκόν ‘readily, wittingly, purposely, as far as depends on one’s will, as far as concerns one’: The basic meaning of the PIE root *u̯ek̑- is ‘to wish’"
Hitt. and PIE heart → be angry; Luw. heart → wish for,desire,desire,"*k̑ḗr, k̑érd-, *k̑r̥d- ‘heart’","*k̑ēr, *k̑r̥d","Ved. hŕ̥d- n. ‘heart’ (nom./acc. sg. hā́rdi, gen. sg. hr̥dás, dat. sg. hr̥dé, loc. pl. hr̥tsú, etc. [RV+]), su-hā́rd- adj. ‘having a good heart, friendly’ (AV+), sarva-hr̥dā́ instr. sg. ‘wholehearted’ (RV 10.160.3); cf. also hŕ̥daya- n. ‘heart’ (RV+), hŕ̥dya- adj. ‘cordial, beloved’ (RV+). – OAv. zərəd- n. ‘heart’ (instr. sg. zərədā-cā [Y 31.12]), YAv. zərəδaiia- n. ‘heart’ [+] Gk. κῆρ n. ‘heart’, dat. sg. κῆρι, κηρόθι adv. ‘with all the heart, heartily’ (Il.+), ἀ-κήριος adj. ‘without heart, lifeless, discouraged’; καρδία, Ion. καρδίη, ep. κραδίη f. ‘heart’ (Il.+) Arm. sirt ‘heart’ (i-stem: gen./dat. sg. srt-i, instr. sg. srt-i-w, gen./dat. pl. srt-i-c‘, etc.) Lat. cor, gen. sg. cordis n. ‘heart, spirit, soul’ (Enn.+); con-cors adj. ‘agreeing, harmonious’ (Naev.+), dis-cors ‘disagreeing’ (Cic.+), etc. [+]OIr. cride n. ‘heart, middle, love’ Goth. haírto n. ‘heart’, ON hjarta n. ‘id.’, OS herta n. ‘id.’, OHG herza n. ‘id.’, etc. OPr. seyr n. ‘heart’; Lith. širdìs f. ‘id.’, šerdìs f. ‘core, kernel, pith’; Latv. sir̂ds f. ‘heart, courage, wrath’ [+] OCS srŭdĭce n. ‘heart’, Russ. sérdce n. ‘id.’, Pol. serce n. ‘id.’, SCr. sȑce n. ‘id.’, etc.; OCS srěda f. ‘middle, community, Wednesday’, Russ. seredá f. (obs.) ‘Wednesday’, SCr. srijèda f. ‘id.’, etc.TochA kri ‘will’, TochB käryāñ nom. pl. ‘hearts","wish; to wish, contrive","/zarti-(ti)/, (COR)za+ra/i-ti-; zartiya-/wish, (COR)za+ra/i-ti-ia-",kardimmi(ye/a)-; TUKU.TUKU -- kēr/kart- n. ‘heart + kardiyas iya - делать согласно желанию ,kārti- ‘heart’,,,,,,,"Hawkins & Morpurgo Davies 1988a:172f. assign /zartiyas/ to the lexeme /zart-/ ´heart´ and parse it as a genitive singular comparing Hitt. kardiyaš gen. sg. of kēr/kard- n. ‘heart’ Read paper on etymology, PIE heart --> be angry is a common shift for many IE languages, есть ли когнаты в анатолийских языках??? Rieken (1999a: 110-111): the root *ḱerd- ‘heart’ served as the basis for a verb *ḱerd-e/o- ‘to be angry’. Of this *ḱerd-e/o- a -men- derivation *ḱerd-i-men- ‘anger’ is formed, of which another verb in *e/o- is derived: *ḱerd-i-mn-e/o-, which regularly yielded Hitt. kartimmie-. PAna *k̑ḗr, k̑érd- / *k̑r̥d-´ ‘heart’."
passion → desire,desire,passion,"*ilo-, *ilaH- ‘passion’",,,passion,"И. Якубович обращает наше внимание на реконструкцию лувийского корня *alali-ti ‘желать’, очевидного когната с хетт. ilaliya-. Дополнительные свидетельства того же корня можно видеть в билингвальной надписи KARATEPE: § 65 /alunazza-i/ ‘желать’ и § 71 /alunnamm(a)-/ ‘похоть’ (Yakubovich 2017: 16).","ilāliye/a-(mi) ‘to desire’; ilā- ‘passion, desire (?)’",ila- 'passion'; ilaliya- 'unknown',,,,,,,https://www.ediana.gwi.uni-muenchen.de/dictionary.php?lemma=906.
"bad → irritated, annoyed",distress,anxiety,*han- (*Hón-/Hn-),,,"to be vexed, perturbed (or vel sim.)","*/haniya-(i)/ 'malicious, redupl. */hanhaniya-(i)/ ; /haniyatt(a)-/, (“MALUS2”)ha-ní-ia-ta- ; /hanhaniwan-/, (“MALUS2”)ha-ha-ní-wa/i- ; GK ḫanḫaniya- '‘to be malicious’'",,,,,,,,,"From PA *Hón-/Hn-´ ‘to be vexed, perturbed’. Considering that the phenomenon of reduplication is productive in Luwian, especially for stems in -iya-(i) (cf. /huwiya-(i)/ ‘to run’ → /hwihwiya-(i)/), and that verbs expressing an emotional state can undergo a full reduplication in Anatolian (cf. Hitt. katkattiye/a-(mi) ‘to tremble’, laḫlaḫḫiye/a-(mi) ‘to be perturbed’), it is more likely that we are dealing with a root *ḫan- (Sasseville 2021:45). See in eDiAna: https://www.ediana.gwi.uni-muenchen.de/dictionary.php?lemma=690"
"noisy agitation in men and birds or animals (onomatopoeic) → fluster and fuss → nervousness, anxiety",distress,anxiety,*lalh-,*leh2-,,to be anxious,"/lalhiliya-/, la+ra/i-hi-ri+i-ia-",laḫlaḫḫiya- (v.); laḫlaḫḫa- (n.) ,,,,,,,,"Finally, as in the semantic field of fear, worry can be expressed by (quasi)onomatopoeic reduplicated root: laḫlaḫiya- ‘be in commotion, scurry, scamper’ (normally with a locative particle =kan, to point out a locative connotation) structured on the same principle as kurkuriye- ‘to scare’ and katkatiya- to tremble’ (and also tastasiya- ' whisper', см. HED L:10–12). A.Kassian (pers.comm.) considers lahlahhiya- as a denominative of lahlahha- (c.), nom. sg. la-ah-la-ah-ha- as (KBo XLII 74 8). Puhvel allows it to be onomatopoeic, as in lah(h)anza(n)- (noisy agitation in men and birds or animals). Speaking of Anatolian cognates, one should refer to HLuw. (“COR”)la+ra/i-hi-ri+i-ia-zi /lalhiliyanzi/, which is a hapax from the Assur letter of the 8th c. BC (Bauer et al. 2017)."
onomatopoeic (< ai) from an interjection of pain *aH! (cf. Hitt. āi!),distress,pain,*áHreh2- ‘pain’,,,pain; state of painfullness,āḫra-; āḫraman-,āḫra- (CL),ārra- ‘pain (?)’Palaic sound change *-Hr- > -rr-,,,,,,,"The Luwian terms āḫra- and waḫra- found in these rituals are conventionally translated as “pain and woe,” which are related to the Hittite onomatopoetic terms aī- and waī- (HW2 A: 47; Kloekhorst 2008: 393; CLL: 4, 249)"
"to tear (one’s clothes, in a mourning ritual) → to grieve",distress,sorrow,*lup-,*leu̯p-,"Skt. lumpati 'break, plunder', lopdyati 'wound',  Lith. laupyti 'strip, rob', OCS lupiti","regret, sorrow, grief",lumpašti- (CL),lumpašti- (CL),,,,,,,,"Puhvel (HED 118): *lewp- may be identical with verbs meaning 'tear off, peel, strip, flay' (Lith. lupti, OCS lupiti), expressing originally (as 'tear atoneself) self-infliction in grieving rituals. Here may belong also Skt. lumpati 'break, plunder', lopdyati 'wound', the latter formally matching Lith. laupyti 'strip, rob' and OCS lupiti; it would showthe nasal, as in lumpasti- (but here the alternative attachment oflumpati to Lat. rumpo 'break' obtrudes)."
two options: blood → tears; rain → tears,distress,tear,*sH1aH1ru-,*sE2eu̯-H2-,"Gk. δάκρυ, Lat. lacruma, Olr. dēr, Goth, tagr, OHG zahar), *draḱur (Arm. artawsr), *draḱnu- (OHG trahan), *aḱru (Ved. áśru, Avest. asrū-, Toch. A ākär [pl. A ākrunt, B akrūna], Lith. ašarà).","tears, to shed tears",(*476)ASḪA-ḫi-ru-r (R.Oreshko),išhahru- /išhahruwe/a-,,,,,,,,"Indo-European 'tear' words are mostly (except Slavic [Russian sleza] and Albanian [lot]) traceable to *daḱru- (<*draḱ-ru-: Gk. δάκρυ, Lat. lacruma, Olr. dēr, Goth, tagr, OHG zahar), *draḱur (Arm. artawsr), *draḱnu- (OHG trahan), *aḱru (Ved. áśru, Avest. asrū-, Toch. A ākär [pl. A ākrunt, B akrūna], Lith. ašarà). ishahru is clearly the basic spelling, with the occasional ēshahru influenced by the proximity of ēshar on the ""calamity lists"" (e.g. KUB VII 41 Vs. 18-19); hence the i- may be phonetically and/or orthographically prothetic (cf. e.g. ishiya-), and a possible reconstruction is *sH1aH1ru-. Oettinger posited ishahru<*sA1aḱru (s-mobile + [A1]aḱru, with h<k as in occasional hazhara- <hazgara-), where the attestation of s-mobile before laryngeal would be chiastically proportionate to Hitt. he(w)u-: Toch. A swase, OPruss. suge 'rain' (*[s]E2ew-H2-). In that case *A1aḱru can hardly be a secondary aberration from *daḱru (the a- vocalism of the latter being also unexplained); there is rather *(s-)A1aḱru- besides *(d-)A1aḱ-ru>*daḱru-, but with occasional *A1>*r in some forms of Indo-European (Arm. artawsr<*draḱur, OHG trahan<*draḱ-nu-), comparable to the Hittite alternation wahnu-: warnu-; another trace of such ""d-mobile"" may be seen in Lith. ilgas 'long' besides the more usual d-forms (Skt. dīrghá-, etc.), or in Ved. áhar 'day' beside OE dōgor. *A1aḱru- conceivably has basic truck with *aḱri-, aḱro- (Skt. áśri- 'edge', Gk. ἄκρις 'point, peak', Lat. ācer, Lith. ašrús, OCS ostrǔ 'sharp'), in the sense of 'bitter, acrid (fluid)' (cf. the universal cliche 'bitter tears'). A clause from ASSUR letter f+g, § 7 read in CHLI (HAWKINS 2000: 536, cf. 550) as follows: ""|“*476”-wa/i-pa-wa/i (*476.*311)ḫi-ru-ra+a-ti-i |ARḪA |wa/i-la-u-ta"". The sequence read as ASḪA-ḫi-ru-ra+a-ti can be interpreted phonetically as as ḫaḫ(e)ruradi which can be analyzed as an abl.-instr.sg. form of asḫaḫ(e)rur-. As a result, the passage can now be interpreted as expressing the idea of ‘eyes dying out from tears’. NB! The mainstream meaning in eDiAna for ASḪA-ḫi-ru-ra+a-ti -- about CURSE and OATH, see https://www.ediana.gwi.uni-muenchen.de/dictionary.php?lemma=3571."
haplology: *alala + lamniya- 'call out alala',distress,wail,*h3ór-/h3r-´,,"Arm. alalak 'cry, scream'; Gk ἄλαλά'cry aloud'","to sob loudly, to wail","(“*476.*311”)a-li-ia- and (“*476”)LOCUS-li-ia- (R.Oreshko)Hieroglyphic Luwian /arla-/, ara/i-la- ‘pedestal, altar (?) Cuneiform Luwian *ārla(/i)- ‘place (?) /aru-/, á-ru ‘highly, in high measure’",alalamnai- alalamniya- рыдать (громко),arū-/-aw- ‘high’,ara- ‘estate’,*eru- ‘high’,,,,*arliš / *arĺiš ,"Perhaps haplological for *alala + lamniya- 'call out alala; cf. Arm. alalak 'cry, scream'; Gk. interjection, 'outcry', 'cry aloud', 'alas', 'cry out'. For lamniya-, cf. s.v. laman-."
onomatopoeic (wow! oi-wei! ← wai-),distress,wail,*u̯āi̯-! ‘woe’ ,*u̯āi̯-! ,"Av., Gk., Lat., Celt., Germ., Balt., Alb.) attest an interjection PIE *u̯ai̯!, which expresses pain, sorrow, grief, etc., thus ‘alas!’","to wail, to scream, to yell","/wai-/, wa/i-i; waḫra-, waḫri-(ti); wiwai-; (GK) uwai- ‘to make someone feel sorry for oneself’; (CL) (u)wāi- ‘woe’ uwai-to make someone feel sorry for oneself",wai-/we-/wesk-/wiya-; waḫra- (CL); wiyai-; (u)wāi- ‘woe’,,,,,,,,"PAnat *u̯āi! ‘woe’. The presence of the word (u)wāi- c. ‘woe’ in both Hittite and Luwian allows us to reconstruct a Proto-Anatolian pre-form. The onomatopoetic character of the word, which can be associated with a cry of pain, leads us to a reconstruction with the vowel -a-, i.e. *u̯āi!. Kloekhorst (EDHIL:939) agrees with the onomatopoetic origin of the word, but suggests that (u)wāi- is nevertheless a derivative of ú-i ‘whee!’ attested in Hittite (KUB 55.38 ii 19). Although it is morphologically possible that (u)wāi- is a morphological creation after (Hittite) diphthong stems in -āi- c., it is not necessary either to posit a derivation. Both ú-i and ú-wa-a-i can be independent onomatopoetic creations, in which the latter became fully lexicalized as a declining noun with the meaning ‘woe’. For the Hittite phrase a-i-in ú-wa-a-i-in see HEG U-Z:170f. and EDHIL:939. Besides PAnat. *u̯āi̯- c. ‘woe’, a noun is attested in distant parts of the IE world (Av., Celt., Germ., Alb.). Thus, the noun may be reconstructed for the proto-language as PIE *u̯ai̯- ‘woe’. “Root” etymology: various non-Anatolian languages (Av., Gk., Lat., Celt., Germ., Balt., Alb.) attest an interjection PIE *u̯ai̯!, which expresses pain, sorrow, grief, etc., thus ‘alas!’ vel sim."
"to weigh a lot, to be heavy (physically) → to carry weight (figuratively) → to be important (shift: heavy burden → heavy → important); weight, heaviness → strength → power, influence → importance → respect, esteem, attentiveness, love",distress / respect,anxiety,*nakki- (from Instr.) ,"*h1nek̑-, *h1nok̑-","Gk. ἐνεγκ-ε/ο-, ἐνήνοχα, carry,  Lith. nasta  'weight, burden'","to trouble, worry; (of a matter/person) to be(come) someone’s concern, to weigh on someone; to be difficult for someone; (as a participle/adj.) honoured, revered; hence valuable, important; to treat with respect, show respect (to)",,"nakkiyaḫḫ-; nakki- 'important'; nakkiyaḫḫ-, nakki-: nakkušatar, nakkušann-; nakkiya-; nakkešš- (together with a synonym dassu- can be written DUGUD)",,,,,,,,Puhvel (HED N:49-51)
"to speak with gravity, loudly → to swear → to give a false oath",enmity,curse,"*h2ēru̯o- 'oath', *h1r̥h1-i̯é/ó- ",*h2er-,,to curse,"ḫīrūtaniya-(ti) ‘to swear, commit perjury’; /hirud-/, (“*476”)hi-ru-tà- ‘curse, false oath (?)’; CL ḫīrūn/t- ‘(false) oath’",ḫurtai-; hu(wa)rt- CL ḫīruta- ‘(false) oath’,,"irdu- ‘oath (?)’ -- hapax, an arrangement that someone can decree for someone else",,,,,,"HED: PIE *h2órt-ei / *h2urt-énti?. *h2uert; *H1wer(t)- (vs. *wer-[E-] in weriya-) with a more specific meaning than the overworked 'feierlich sprechen'. Plausible cognates are Skt. vrata- 'vow', OCS rota 'oath', OPr. wer-temmai 'we swear', and perhaps (in malam partem) Russ. vrat' 'lie', OCS vraci 'conjurer, magician, physician' Kloekhorst 372 ḫuart-i / ḫurt- (IIa1 > IIa1) ‘to curse’ IE cognates: ?OPr. wertemmai ‘we swear’. Sturtevant (1930d: 128) connected this verb with Lat. verbum ‘word’, Lith. vadas ‘name’, OPr. wirds ‘word’, Goth. waurd ‘word’. Puhvel (l.c.) rejects this etymology because he assumes that these latter words are derived from the root found in Gr.‘to speak’ and Hitt. erie/a-zi ‘to call, to name’: since Hitt. erie/a- does not show an initial laryngeal whereas Hitt. uart-i / urt- does, he claims that the connection cannot be correct. This reasoning is questionable, however, in view of the fact that Hitt. erie/a-zi must reflect *uerh1- (because of Gr. ""(fut.)), which is impossible for Lith. vadas, which must reflect *ordho- (a preform **orh1dho-would have yielded Lith. **várdas). So, formally, Sturtevant’s connection between uart-i / urt- and Lat. verbum etc. is still possible: it would mean that we have to reconstruct a root *h2uerdh -. The semantic connection between ‘to curse’ and ‘name, word’ is not compelling, however. Puhvel (l.c.) proposed a different etymology, namely a connection with OPr. wertemmai ‘we swear’. This connection is semantically more likely and would point to a root *h2uert-. The absence of any other IE cognates is unpleasant, however. *h2ēru̯o- ‘oath’ Laroche 1955a:78-81 first elucidated the meaning of ḫīrūn/t- by equating it with Hitt. lengai- c. ‘oath’. After Otten 1953a:95 n. 166 had noticed that ḫīrūn/t- has a negative connotation, Laroche pointed out the following features of the word: a) it is used as a modifier of ‘tongue’ and ‘lord’, b) it is also collocated with taparu- ‘(something negative, humiliation, https://www.ediana.gwi.uni-muenchen.de/dictionary.php?lemma=3567)’ and tātariyam(ma)n- ‘curse’ in Luwian, c) it is used as an epithet of Išḫara and the Sun-god functioning as a guardian and witness of oath, respectively, d) EME ‘tongue’ is modified by the genitival attributes lengai- ‘oath’ and ḫurtai- ‘oath’ in Hittite. Taken together, the evidence allows to equate semantically ḫīrūn/t- with lengai- ‘oath’. Laroche’s interpretation was generally accepted and soon entered the handbooks; Vedic ā́-aryanti ‘they appreciate, acknowledge’, āritá- ‘acknowledged’, ncient Greek ἀρά, Ionic ᾱ̓ρή f. ‘prayer, vow, curse’ (Il.+) < *aru̯ā́, Arcadian κάταρϝος ‘cursed’, (?) Mycenaean personal names ka-ta-wa, ka-ta-wo, (?) ἀρύω ‘reply, order, cry, call’, Latin ōrō, -āre ‘argue, plead; pray to, beseech’ (Lex XII, Andr.+), Oscan urust 3sg fut. perf. ‘will have argued (publicly), Russian orú, orátь ‘yell, scream’, Serbo-Croatian oriti se ‘resound, resonate, Armenian owranam, aor. owracʿaw ‘deny, disavow’ In LIV²:271 s.v. ?3. *h2er-, the meaning of the root is rendered as ‘speak with gravity, loudly’ (“gewichtig/laut sprechen”; see also Rix 1993a:331–334), which fits to most of the verbal and nominal continuants of the root in the Indo-European languages that predominantly refer to some official or performative speech act."
to speak → to curse,enmity,curse,*tér-/tṛ-´,,,to curse,"HL /tadariya-(i)/, (LOQUI)tá-tara/i-ia- ‘to curse’; CL *tatariya-(i) ‘to curse’",tar- ‘to say’,dar- ‘to speak (?)’,,dderije-(ti) ‘to curse (?)’,,,,,"PLuwic *tedorii̯a-(i) ‘to curse’ Skt. tārá- ‘loud, shrill, pervasive’ [+] Gk. fut. 1sg. τετορήσω ‘to proclaim in shrill piercing tones’ (hapax, Ar.Pax381), τορός ‘loud, shrill, clear; fast, agile’, OIr. torm ‘sound, tumult’, Lith. tariù, tarýti ‘to speak, say’, OPr. attrātwei, etc. ‘to answer’, acc. sg. tārin f. ‘voice’ (III) EDBIL:—, ALEW 2.0 s.v. tar̃ti (2022-02-11), PKEŽ² s.vv. tārin (2022-02-23), attrātwei (2022-02-23), Smoczyński 2005a:131 (?), Russ. torotórit’ ‘to chatter’, Cz. trátořiti ‘to chatter (a lot)’ TochB m‑part. tärraskemane ‘pleading, imploring’ or ‘comforting, soothing’ (hapax, THT 85 a 3) PIE *terh1- ‘to drill, rub’ (LIV²:632f.) or PIE *terh2- ‘to pass, cross’ ? but PIE *ter- ‘to speak’."
